{
  "org_id": "01931a4b-9c10-7000-8000-000000000010",
  "user_id": "01931a4b-9c10-7000-8000-000000000001",
  "affected_principal_ids": [
    "01931a4b-9c10-7000-8000-000000000001",
    "01931a4b-9c10-7000-8000-000000000010"
  ],
  "removed_at": "2026-05-07T08:34:56.789012Z",
  "_envelope_version": 1
}
